<?xml version="1.0" encoding="UTF-8"?>
<xs:schema xmlns:xs="http://www.w3.org/2001/XMLSchema" elementFormDefault="qualified"
  targetNamespace="http://ftn.uns.ac.rs/zalba_na_odluku"
  xmlns="http://ftn.uns.ac.rs/zalba_na_odluku">
  <xs:element name="zalba_na_odluku">
    <xs:complexType>
      <xs:sequence>
        <xs:element ref="sadrzaj_zalbe"/>
      </xs:sequence>
    </xs:complexType>
  </xs:element>
  <xs:element name="sadrzaj_zalbe">
    <xs:complexType>
      <xs:sequence>
        <xs:element ref="naslov"/>
        <xs:element maxOccurs="unbounded" ref="paragraf"/>
        <xs:element ref="podnožje"/>
      </xs:sequence>
    </xs:complexType>
  </xs:element>
  <xs:element name="naslov" type="xs:string"/>
  <xs:element name="paragraf">
    <xs:complexType mixed="true">
      <xs:choice minOccurs="0" maxOccurs="unbounded">
        <xs:element ref="adresa_za_postu"/>
        <xs:element ref="naslov2"/>
        <xs:element ref="naziv_organa"/>
        <xs:element ref="obrazlozenje_zalbe"/>
        <xs:element ref="podnosilac_zalbe"/>
        <xs:element ref="zakon"/>
      </xs:choice>
      <xs:attribute name="id" use="required" type="xs:NCName"/>
    </xs:complexType>
  </xs:element>
  <xs:element name="adresa_za_postu">
    <xs:complexType>
      <xs:sequence>
        <xs:element ref="grad"/>
        <xs:element ref="ulica"/>
        <xs:element ref="broj"/>
      </xs:sequence>
    </xs:complexType>
  </xs:element>
  <xs:element name="broj_input">
    <xs:complexType/>
  </xs:element>
  <xs:element name="godina_input">
    <xs:complexType/>
  </xs:element>
  <xs:element name="naslov2" type="xs:string"/>
  <xs:element name="naziv_organa" type="xs:string"> </xs:element>
  <xs:element name="obrazlozenje_zalbe" type="xs:string"> </xs:element>
  <xs:element name="podnosilac_zalbe">
    <xs:complexType>
      <xs:sequence>
        <xs:element ref="podnosilac_ime"/>
        <xs:element ref="podnosilac_prezime"/>
        <xs:element ref="podnosilac_naziv"/>
        <xs:element ref="podnosilac_adresa"/>
        <xs:element ref="podnosilac_sediste"/>
      </xs:sequence>
    </xs:complexType>
  </xs:element>
  <xs:element name="podnosilac_ime" type="xs:string"> </xs:element>
  <xs:element name="podnosilac_prezime" type="xs:string"> </xs:element>
  <xs:element name="podnosilac_naziv" type="xs:string"> </xs:element>
  <xs:element name="podnosilac_adresa">
    <xs:complexType>
      <xs:sequence>
        <xs:element ref="grad"/>
        <xs:element ref="ulica"/>
        <xs:element ref="broj"/>
      </xs:sequence>
    </xs:complexType>
  </xs:element>
  <xs:element name="podnosilac_sediste" type="xs:string"> </xs:element>
  <xs:element name="zakon">
    <xs:complexType>
      <xs:attribute name="naziv" use="required" type="xs:string"/>
      <xs:attribute name="stav" use="required" type="xs:integer"/>
      <xs:attribute name="član" use="required" type="xs:integer"/>
    </xs:complexType>
  </xs:element>
  <xs:element name="podnožje">
    <xs:complexType>
      <xs:sequence>
        <xs:element ref="mesto_i_datum"/>
        <xs:element ref="informacije_o_tražiocu"/>
        <xs:element ref="napomene"/>
      </xs:sequence>
    </xs:complexType>
  </xs:element>
  <xs:element name="mesto_i_datum">
    <xs:complexType mixed="true">
      <xs:choice minOccurs="0" maxOccurs="unbounded">
        <xs:element ref="dan"/>
        <xs:element ref="godina"/>
        <xs:element ref="mesto"/>
      </xs:choice>
    </xs:complexType>
  </xs:element>
  <xs:element name="dan" type="xs:date"> </xs:element>
  <xs:element name="godina" type="xs:date"> </xs:element>
  <xs:element name="mesto" type="xs:string"> </xs:element>
  <xs:element name="informacije_o_tražiocu">
    <xs:complexType mixed="true">
      <xs:choice minOccurs="0" maxOccurs="unbounded">
        <xs:element ref="adresa"/>
        <xs:element ref="ime_i_prezime"/>
        <xs:element ref="kontakt"/>
        <xs:element ref="potpis"/>
      </xs:choice>
    </xs:complexType>
  </xs:element>
  <xs:element name="adresa">
    <xs:complexType>
      <xs:sequence>
        <xs:element ref="grad"/>
        <xs:element ref="ulica"/>
        <xs:element ref="broj"/>
      </xs:sequence>
    </xs:complexType>
  </xs:element>
  <xs:element name="ime_i_prezime" type="xs:string"> </xs:element>
  <xs:element name="kontakt" type="xs:string"> </xs:element>
  <xs:element name="potpis" type="xs:string"> </xs:element>
  <xs:element name="napomene">
    <xs:complexType>
      <xs:sequence>
        <xs:element maxOccurs="unbounded" ref="napomena"/>
      </xs:sequence>
    </xs:complexType>
  </xs:element>
  <xs:element name="napomena">
    <xs:complexType mixed="true">
      <xs:attribute name="id" use="required" type="xs:NCName"/>
    </xs:complexType>
  </xs:element>
  <xs:element name="grad" type="xs:string"/>
  <xs:element name="ulica" type="xs:string"/>
  <xs:element name="broj" type="xs:integer"/>
</xs:schema>
